{
  "artifact_schema_version": 1,
  "bridge": {
    "changes": [
      {
        "index_status": ".",
        "original_path": null,
        "path": "schemas/benchmark-run-artifact-v1.schema.json",
        "status": "modified",
        "worktree_status": "M"
      },
      {
        "index_status": ".",
        "original_path": null,
        "path": "src/sigmap_codex_bridge/experiment.py",
        "status": "modified",
        "worktree_status": "M"
      },
      {
        "index_status": ".",
        "original_path": null,
        "path": "tests/test_benchmark_schema.py",
        "status": "modified",
        "worktree_status": "M"
      },
      {
        "index_status": ".",
        "original_path": null,
        "path": "tests/test_experiment.py",
        "status": "modified",
        "worktree_status": "M"
      }
    ],
    "codex": {
      "command_event_count": 17,
      "detail": null,
      "event_count": 46,
      "file_changes": [
        "/Users/manojmallick/Documents/sigmap-codex-bridge/.bridge-worktrees/runs/benchmark-18c8bf8260b34ccc9db4289d6ca68f9e/schemas/benchmark-run-artifact-v1.schema.json",
        "/Users/manojmallick/Documents/sigmap-codex-bridge/.bridge-worktrees/runs/benchmark-18c8bf8260b34ccc9db4289d6ca68f9e/src/sigmap_codex_bridge/experiment.py",
        "/Users/manojmallick/Documents/sigmap-codex-bridge/.bridge-worktrees/runs/benchmark-18c8bf8260b34ccc9db4289d6ca68f9e/tests/test_benchmark_schema.py",
        "/Users/manojmallick/Documents/sigmap-codex-bridge/.bridge-worktrees/runs/benchmark-18c8bf8260b34ccc9db4289d6ca68f9e/tests/test_experiment.py"
      ],
      "final_message": "Implemented explicit `run_status` serialization.\n\n- `\"passed\"` only when `score.passed`, `worktree_cleaned`, and empty `failure_details` are all satisfied.\n- Otherwise `\"failed\"`.\n- Updated the [public JSON Schema](/Users/manojmallick/Documents/sigmap-codex-bridge/.bridge-worktrees/runs/benchmark-18c8bf8260b34ccc9db4289d6ca68f9e/schemas/benchmark-run-artifact-v1.schema.json:9) to require the enum field.\n- Added focused happy-path and all failure-condition tests in [test_experiment.py](/Users/manojmallick/Documents/sigmap-codex-bridge/.bridge-worktrees/runs/benchmark-18c8bf8260b34ccc9db4289d6ca68f9e/tests/test_experiment.py:94) and schema coverage.\n\nVerification: 55 tests passed, 1 skipped; Ruff and `git diff --check` passed.",
      "process": {
        "command": [
          "/Applications/ChatGPT.app/Contents/Resources/codex",
          "exec",
          "--json",
          "--sandbox",
          "workspace-write",
          "--model",
          "gpt-5.6-sol",
          "Add an explicit run_status field to BenchmarkRunArtifact serialization. It must be \"passed\" only when the independent score passes, the worktree was cleaned, and failure_details is empty; otherwise it must be \"failed\". Update the public run-artifact JSON Schema and focused tests while preserving the existing artifact fields and behavior. Run the relevant tests."
        ],
        "cwd": "/Users/manojmallick/Documents/sigmap-codex-bridge/.bridge-worktrees/runs/benchmark-18c8bf8260b34ccc9db4289d6ca68f9e",
        "duration_seconds": 216.274036,
        "launch_error": null,
        "returncode": 0,
        "stderr": "Reading additional input from stdin...\n2026-07-18T15:55:36.614439Z  WARN codex_core_skills::loader: ignoring interface.icon_small: icon path with '..' must resolve under plugin assets/\n2026-07-18T15:55:36.614458Z  WARN codex_core_skills::loader: ignoring interface.icon_large: icon path with '..' must resolve under plugin assets/\n2026-07-18T15:55:37.118139Z  WARN codex_core_skills::loader: ignoring interface.icon_small: icon path with '..' must resolve under plugin assets/\n2026-07-18T15:55:37.118152Z  WARN codex_core_skills::loader: ignoring interface.icon_large: icon path with '..' must resolve under plugin assets/\n",
        "stdout": "{\"type\":\"thread.started\",\"thread_id\":\"019f75f0-b305-7662-b927-ef871cf92abc\"}\n{\"type\":\"turn.started\"}\n{\"type\":\"item.completed\",\"item\":{\"id\":\"item_0\",\"type\":\"agent_message\",\"text\":\"I\u2019m using the SigMap context workflow because this change is narrowly scoped and the supplied symbol map can guide us straight to serialization, schema, and focused tests. I\u2019ll inspect those targets, patch the smallest surface, and run the relevant test subset.\"}}\n{\"type\":\"item.started\",\"item\":{\"id\":\"item_1\",\"type\":\"command_execution\",\"command\":\"/bin/zsh -lc \\\"sed -n '1,240p' /Users/manojmallick/.codex/skills/sigmap-context/SKILL.md\\\"\",\"aggregated_output\":\"\",\"exit_code\":null,\"status\":\"in_progress\"}}\n{\"type\":\"item.completed\",\"item\":{\"id\":\"item_1\",\"type\":\"command_execution\",\"command\":\"/bin/zsh -lc \\\"sed -n '1,240p' /Users/manojmallick/.codex/skills/sigmap-context/SKILL.md\\\"\",\"aggregated_output\":\"---\\nname: sigmap-context\\ndescription: Use SigMap to gather compact, grounded repository context before coding, reviewing, planning, debugging, or answering architecture questions. Trigger when the user mentions SigMap/sigmap, asks to reduce token usage, asks for better codebase coverage, works in a large repository, or when Codex needs focused file/symbol context without reading broad raw file output.\\n---\\n\\n# SigMap Context\\n\\nUse SigMap as the repo-orientation layer before broad `rg`, `find`, or large file reads. The goal is to identify the right files first, then read only what the task needs.\\n\\n## Workflow\\n\\n1. Start at the repository root:\\n   ```bash\\n   git rev-parse --show-toplevel\\n   ```\\n\\n2. Check health when setup, coverage, or freshness matters:\\n   ```bash\\n   npx sigmap doctor --json\\n   npx sigmap --report --json\\n   ```\\n   Treat `doctor` warnings as setup work before coding. Regenerate context after source/config changes:\\n   ```bash\\n   npx sigmap\\n   npx sigmap --adapter codex\\n   ```\\n\\n3. For a task, ask SigMap first:\\n   ```bash\\n   npx sigmap ask \\\"<task or question>\\\" --top 8 --no-squeeze\\n   npx sigmap --query \\\"<task or question>\\\" --top 8 --json\\n   ```\\n   Read `.context/query-context.md` or the JSON-ranked file list, then open only the top relevant files.\\n\\n4. For broader work, build an evidence pack instead of dumping many files:\\n   ```bash\\n   npx sigmap evidence \\\"<task or question>\\\" --top 10 --budget 6000 --markdown\\n   ```\\n   Use the evidence pack to decide which files to inspect. Keep command output capped.\\n\\n5. For noisy command/tool output, compress before bringing it into context:\\n   ```bash\\n   npx sigmap squeeze --response <file-or-stdin>\\n   ```\\n\\n6. Before finalizing plans or reviews, use grounding checks when relevant:\\n   ```bash\\n   npx sigmap verify-plan <plan.md>\\n   npx sigmap verify <answer.md>\\n   npx sigmap review-pr --staged\\n   ```\\n\\n## AgentOS Defaults\\n\\nFor `/Users/manojmallick/Downloads/agentos`, SigMap should run from the repo root with:\\n\\n- Source roots: `src`, `src-test`, `desktop`, `config`, `.github`\\n- Generated context outputs: `.github/copilot-instructions.md` and `AGENTS.md`\\n- Ignore paths: build outputs, dependency folders, compiled classes, jars, `.context`, and local Claude config\\n\\nIf these drift, update `gen-context.config.json` and `.contextignore`, then rerun:\\n\\n```bash\\nnpx sigmap\\nnpx sigmap --adapter codex\\nnpx sigmap doctor --json\\n```\\n\\n## Context Discipline\\n\\n- Prefer SigMap ranking before broad text search.\\n- Use `rg` after SigMap to inspect specific files, symbols, or call sites.\\n- Do not paste full generated context files into the chat unless the user asks.\\n- Do not let SigMap replace verification: still compile, test, or run the app when changing behavior.\\n\",\"exit_code\":0,\"status\":\"completed\"}}\n{\"type\":\"item.started\",\"item\":{\"id\":\"item_2\",\"type\":\"command_execution\",\"command\":\"/bin/zsh -lc 'git rev-parse --show-toplevel && npx sigmap ask \\\"Add explicit run_status to BenchmarkRunArtifact serialization, public run-artifact JSON Schema, and focused tests\\\" --top 8 --no-squeeze'\",\"aggregated_output\":\"\",\"exit_code\":null,\"status\":\"in_progress\"}}\n{\"type\":\"item.completed\",\"item\":{\"id\":\"item_3\",\"type\":\"agent_message\",\"text\":\"SigMap is still building the focused ranking. While it finishes, I\u2019m keeping the scope to the artifact dataclass/serializer, the published schema, and existing artifact tests so unrelated behavior remains untouched.\"}}\n{\"type\":\"item.started\",\"item\":{\"id\":\"item_4\",\"type\":\"command_execution\",\"command\":\"/bin/zsh -lc 'git status --short && rg -n \\\"BenchmarkRunArtifact|run-artifact|worktree_cleaned|failure_details\\\" src tests schemas pyproject.toml README.md 2>/dev/null'\",\"aggregated_output\":\"\",\"exit_code\":null,\"status\":\"in_progress\"}}\n{\"type\":\"item.completed\",\"item\":{\"id\":\"item_4\",\"type\":\"command_execution\",\"command\":\"/bin/zsh -lc 'git status --short && rg -n \\\"BenchmarkRunArtifact|run-artifact|worktree_cleaned|failure_details\\\" src tests schemas pyproject.toml README.md 2>/dev/null'\",\"aggregated_output\":\"tests/test_bridge_isolation.py:48:            self.assertTrue(result.worktree_cleaned)\\nschemas/benchmark-run-artifact-v1.schema.json:3:  \\\"$id\\\": \\\"https://github.com/manojmallick/sigmap-codex-bridge/schemas/benchmark-run-artifact-v1.schema.json\\\",\\nschemas/benchmark-run-artifact-v1.schema.json:24:    \\\"failure_details\\\"\\nschemas/benchmark-run-artifact-v1.schema.json:62:    \\\"failure_details\\\": { \\\"type\\\": \\\"array\\\", \\\"items\\\": { \\\"type\\\": \\\"string\\\" } }\\nsrc/sigmap_codex_bridge/reporting.py:107:            \\\"failure_details\\\": row.get(\\\"failure_details\\\", []),\\nsrc/sigmap_codex_bridge/reporting.py:110:        if row.get(\\\"failure_details\\\") or not bool(row[\\\"score\\\"][\\\"passed\\\"])  # type: ignore[index]\\nsrc/sigmap_codex_bridg